<admin-ui xmlns:xsi="http://www.w3.org/2001/XMLSchema-instance" xsi:noNamespaceSchemaLocation="../../../../../../../../../../src/Core/System/CustomEntity/Xml/Config/AdminUi/admin-ui-1.0.xsd">
    <entity name="ce_duplicate_ref_in_card" navigation-parent="ct-content" position="50" icon="regular-tools-alt" color="#f00">
        <listing>
            <columns>
                <column ref="test_string"/>
            </columns>
        </listing>
        <detail>
            <tabs>
                <tab name="firstTab">
                    <card name="testWithString">
                        <field ref="test_string"/>
                        <field ref="test_string"/>
                    </card>
                </tab>
            </tabs>
        </detail>
    </entity>
</admin-ui>
